{
  "spec_version": "1",
  "origin_form": "http://127.0.0.1",
  "synthesized_resources": { "enabled": false, "fixtures": [] },
  "options_cors": "implementation-defined",
  "escape_policy": "reject-escaping",
  "case_sensitive_lookup": true,
  "execution_metadata_headers": true,
  "error_body_formats": ["text/plain", "application/json"],
  "max_error_body_bytes": 8192,
  "writes_enabled": true,
  "deletes_enabled": true,
  "put_creates_parents": true,
  "runtime_artifact_paths": [],
  "command_full_http_response": { "enabled": false }
}
